{"agentProcessCount":4,"baselineCandidate":"margin-0.3.2-structured-manual-v17","benchmarkVersion":"0.1.0","candidate":"margin-0.3.2-agent-recovery-v20","controlProfile":"role-separated-margin-only-v1","developmentCases":true,"episodeCount":1,"failurePolicy":{"completedJobReplay":"verify-and-skip","continueAfterIncompleteJob":false,"retryCreatesNewRun":true},"id":"sha256:588a57829aadbfda305378413e9a8cb04d9a5b152c864dff8147c68a257c759d","jobCount":2,"jobs":[{"agentProcessCount":2,"candidateID":"margin-0.3.2-structured-manual-v17","candidatePosition":0,"episodeID":"staged_multifile:0:00a47f179db6","fingerprint":"00a47f179db6cf46601030ae44d931c673d30d883dc9a2c42faf4fe944dcecab","id":"sha256:535190bb77cbb162742568542b4ca221e02629ef341f02cb718090602d2aab90","ordinal":0,"phasePolicy":"scenario-defined","repetition":0,"roles":["author","reviewer"],"scenario":"staged_multifile","traceSeats":["author","reviewer"]},{"agentProcessCount":2,"candidateID":"margin-0.3.2-agent-recovery-v20","candidatePosition":1,"episodeID":"staged_multifile:0:00a47f179db6","fingerprint":"00a47f179db6cf46601030ae44d931c673d30d883dc9a2c42faf4fe944dcecab","id":"sha256:be04d7266880a066481a05c9fdf4ec55b55dc5ca4d546fdd749ab99053997de9","ordinal":1,"phasePolicy":"scenario-defined","repetition":0,"roles":["author","reviewer"],"scenario":"staged_multifile","traceSeats":["author","reviewer"]}],"roleProcessCount":4,"schema":"urn:marginbench:execution-plan:v1","studyPlanSha256":"9d094763c93bf3172482aefe02654a5b81758759fdce26cc0763630d25e725f6","taskSet":"public-development-v1"}
